{
  "schemaVersion": 2,
  "packId": "guards",
  "speakerGroups": ["SECURITY_GUARD"],
  "fallbackEvent": "fallback.guard.generic",
  "lines": [
    {"id":"guard.challenge.01","event":"guard.challenge","speakerArchetypes":["security_guard"],"intensity":3,"weight":1.0,"cooldownSeconds":900,"sessionMax":1,"reuseGroup":"guard_challenge","noRepeatGroup":"guard_challenge","conditions":{"all":["guard_armed"],"any":[],"none":[]},"tags":[],"delivery":{"type":"subtitle","text":"Back away from the counter.","ambientSpeech":null,"voiceAsset":null}},
    {"id":"guard.challenge.02","event":"guard.challenge","speakerArchetypes":["security_guard"],"intensity":4,"weight":1.0,"cooldownSeconds":900,"sessionMax":1,"reuseGroup":"guard_challenge","noRepeatGroup":"guard_challenge","conditions":{"all":["guard_armed"],"any":[],"none":[]},"tags":[],"delivery":{"type":"subtitle","text":"Put the weapon down.","ambientSpeech":null,"voiceAsset":null}},
    {"id":"guard.challenge.03","event":"guard.challenge","speakerArchetypes":["security_guard"],"intensity":3,"weight":0.9,"cooldownSeconds":900,"sessionMax":1,"reuseGroup":"guard_challenge","noRepeatGroup":"guard_challenge","conditions":{"all":["guard_armed"],"any":[],"none":[]},"tags":[],"delivery":{"type":"subtitle","text":"That's far enough.","ambientSpeech":null,"voiceAsset":null}},
    {"id":"guard.challenge.04","event":"guard.challenge","speakerArchetypes":["security_guard"],"intensity":4,"weight":1.0,"cooldownSeconds":900,"sessionMax":1,"reuseGroup":"guard_challenge","noRepeatGroup":"guard_challenge","conditions":{"all":["guard_armed"],"any":[],"none":[]},"tags":[],"delivery":{"type":"subtitle","text":"Stop right there.","ambientSpeech":null,"voiceAsset":null}},
    {"id":"guard.challenge.05","event":"guard.challenge","speakerArchetypes":["security_guard"],"intensity":3,"weight":0.9,"cooldownSeconds":900,"sessionMax":1,"reuseGroup":"guard_challenge","noRepeatGroup":"guard_challenge","conditions":{"all":["guard_armed"],"any":[],"none":[]},"tags":[],"delivery":{"type":"subtitle","text":"Don't make this worse.","ambientSpeech":null,"voiceAsset":null}},
    {"id":"guard.challenge.06","event":"guard.challenge","speakerArchetypes":["security_guard"],"intensity":4,"weight":0.9,"cooldownSeconds":900,"sessionMax":1,"reuseGroup":"guard_challenge","noRepeatGroup":"guard_challenge","conditions":{"all":["guard_armed"],"any":[],"none":[]},"tags":[],"delivery":{"type":"subtitle","text":"Step back. Now.","ambientSpeech":null,"voiceAsset":null}},
    {"id":"guard.surrender.01","event":"guard.surrender","speakerArchetypes":["security_guard"],"intensity":2,"weight":1.0,"cooldownSeconds":1200,"sessionMax":1,"reuseGroup":"guard_surrender","noRepeatGroup":"guard_surrender","conditions":{"all":["guard_outnumbered"],"any":[],"none":[]},"tags":[],"delivery":{"type":"subtitle","text":"All right, I'm done.","ambientSpeech":null,"voiceAsset":null}},
    {"id":"guard.surrender.02","event":"guard.surrender","speakerArchetypes":["security_guard"],"intensity":2,"weight":1.0,"cooldownSeconds":1200,"sessionMax":1,"reuseGroup":"guard_surrender","noRepeatGroup":"guard_surrender","conditions":{"all":["guard_outnumbered"],"any":[],"none":[]},"tags":[],"delivery":{"type":"subtitle","text":"Okay. I'm backing off.","ambientSpeech":null,"voiceAsset":null}},
    {"id":"guard.surrender.03","event":"guard.surrender","speakerArchetypes":["security_guard"],"intensity":2,"weight":0.9,"cooldownSeconds":1200,"sessionMax":1,"reuseGroup":"guard_surrender","noRepeatGroup":"guard_surrender","conditions":{"all":["guard_outnumbered"],"any":[],"none":[]},"tags":[],"delivery":{"type":"subtitle","text":"Fine. I surrender.","ambientSpeech":null,"voiceAsset":null}},
    {"id":"guard.surrender.04","event":"guard.surrender","speakerArchetypes":["security_guard"],"intensity":2,"weight":0.9,"cooldownSeconds":1200,"sessionMax":1,"reuseGroup":"guard_surrender","noRepeatGroup":"guard_surrender","conditions":{"all":["guard_outnumbered"],"any":[],"none":[]},"tags":[],"delivery":{"type":"subtitle","text":"I'm not fighting you.","ambientSpeech":null,"voiceAsset":null}},
    {"id":"fallback.guard.01","event":"fallback.guard.generic","speakerArchetypes":["security_guard"],"intensity":1,"weight":0.7,"cooldownSeconds":120,"sessionMax":2,"reuseGroup":"guard_fallback","noRepeatGroup":"guard_fallback","conditions":{"all":[],"any":[],"none":[]},"tags":["fallback"],"delivery":{"type":"subtitle","text":"Easy.","ambientSpeech":null,"voiceAsset":null}},
    {"id":"fallback.guard.02","event":"fallback.guard.generic","speakerArchetypes":["security_guard"],"intensity":1,"weight":0.7,"cooldownSeconds":120,"sessionMax":2,"reuseGroup":"guard_fallback","noRepeatGroup":"guard_fallback","conditions":{"all":[],"any":[],"none":[]},"tags":["fallback"],"delivery":{"type":"subtitle","text":"Stay back.","ambientSpeech":null,"voiceAsset":null}},
    {"id":"fallback.guard.03","event":"fallback.guard.generic","speakerArchetypes":["security_guard"],"intensity":1,"weight":0.7,"cooldownSeconds":120,"sessionMax":2,"reuseGroup":"guard_fallback","noRepeatGroup":"guard_fallback","conditions":{"all":[],"any":[],"none":[]},"tags":["fallback"],"delivery":{"type":"subtitle","text":"I hear you.","ambientSpeech":null,"voiceAsset":null}},
    {"id":"fallback.guard.04","event":"fallback.guard.generic","speakerArchetypes":["security_guard"],"intensity":1,"weight":0.7,"cooldownSeconds":120,"sessionMax":2,"reuseGroup":"guard_fallback","noRepeatGroup":"guard_fallback","conditions":{"all":[],"any":[],"none":[]},"tags":["fallback"],"delivery":{"type":"subtitle","text":"All right.","ambientSpeech":null,"voiceAsset":null}}
  ]
}
