{
  "schemaVersion": 2,
  "packId": "civilians",
  "speakerGroups": ["CIVILIAN"],
  "fallbackEvent": "fallback.civilian.generic",
  "lines": [
    {"id":"civilian.panic.01","event":"civilian.panic","speakerArchetypes":["civilian_any"],"intensity":3,"weight":1.0,"cooldownSeconds":600,"sessionMax":1,"reuseGroup":"civilian_panic","noRepeatGroup":"civilian_panic","conditions":{"all":[],"any":[],"none":[]},"tags":[],"delivery":{"type":"subtitle","text":"Oh my God!","ambientSpeech":null,"voiceAsset":null}},
    {"id":"civilian.panic.02","event":"civilian.panic","speakerArchetypes":["civilian_any"],"intensity":3,"weight":1.0,"cooldownSeconds":600,"sessionMax":1,"reuseGroup":"civilian_panic","noRepeatGroup":"civilian_panic","conditions":{"all":[],"any":[],"none":[]},"tags":[],"delivery":{"type":"subtitle","text":"What's happening?","ambientSpeech":null,"voiceAsset":null}},
    {"id":"civilian.panic.03","event":"civilian.panic","speakerArchetypes":["civilian_any"],"intensity":4,"weight":1.0,"cooldownSeconds":600,"sessionMax":1,"reuseGroup":"civilian_panic","noRepeatGroup":"civilian_panic","conditions":{"all":["shots_fired"],"any":[],"none":[]},"tags":[],"delivery":{"type":"subtitle","text":"No, no, no!","ambientSpeech":null,"voiceAsset":null}},
    {"id":"civilian.panic.04","event":"civilian.panic","speakerArchetypes":["civilian_any"],"intensity":3,"weight":0.9,"cooldownSeconds":600,"sessionMax":1,"reuseGroup":"civilian_panic","noRepeatGroup":"civilian_panic","conditions":{"all":[],"any":[],"none":[]},"tags":[],"delivery":{"type":"subtitle","text":"Everybody get back!","ambientSpeech":null,"voiceAsset":null}},
    {"id":"civilian.panic.05","event":"civilian.panic","speakerArchetypes":["civilian_any"],"intensity":4,"weight":1.1,"cooldownSeconds":600,"sessionMax":1,"reuseGroup":"civilian_panic","noRepeatGroup":"civilian_panic","conditions":{"all":["player_aiming"],"any":[],"none":[]},"tags":[],"delivery":{"type":"subtitle","text":"Please don't shoot!","ambientSpeech":null,"voiceAsset":null}},
    {"id":"civilian.panic.06","event":"civilian.panic","speakerArchetypes":["civilian_any"],"intensity":3,"weight":0.9,"cooldownSeconds":600,"sessionMax":1,"reuseGroup":"civilian_panic","noRepeatGroup":"civilian_panic","conditions":{"all":[],"any":[],"none":[]},"tags":[],"delivery":{"type":"subtitle","text":"This can't be happening.","ambientSpeech":null,"voiceAsset":null}},
    {"id":"civilian.panic.07","event":"civilian.panic","speakerArchetypes":["civilian_any"],"intensity":4,"weight":1.0,"cooldownSeconds":600,"sessionMax":1,"reuseGroup":"civilian_panic","noRepeatGroup":"civilian_panic","conditions":{"all":["player_close"],"any":[],"none":[]},"tags":[],"delivery":{"type":"subtitle","text":"Get away from me!","ambientSpeech":null,"voiceAsset":null}},
    {"id":"civilian.panic.08","event":"civilian.panic","speakerArchetypes":["civilian_any"],"intensity":4,"weight":0.9,"cooldownSeconds":600,"sessionMax":1,"reuseGroup":"civilian_panic","noRepeatGroup":"civilian_panic","conditions":{"all":[],"any":["shots_fired","civilian_injured"],"none":[]},"tags":[],"delivery":{"type":"subtitle","text":"Somebody help!","ambientSpeech":null,"voiceAsset":null}},
    {"id":"civilian.flee.01","event":"civilian.flee","speakerArchetypes":["civilian_any"],"intensity":3,"weight":1.0,"cooldownSeconds":600,"sessionMax":1,"reuseGroup":"civilian_flee","noRepeatGroup":"civilian_flee","conditions":{"all":[],"any":[],"none":[]},"tags":[],"delivery":{"type":"subtitle","text":"I'm leaving!","ambientSpeech":null,"voiceAsset":null}},
    {"id":"civilian.flee.02","event":"civilian.flee","speakerArchetypes":["civilian_any"],"intensity":3,"weight":1.0,"cooldownSeconds":600,"sessionMax":1,"reuseGroup":"civilian_flee","noRepeatGroup":"civilian_flee","conditions":{"all":[],"any":[],"none":[]},"tags":[],"delivery":{"type":"subtitle","text":"I'm getting out of here.","ambientSpeech":null,"voiceAsset":null}},
    {"id":"civilian.flee.03","event":"civilian.flee","speakerArchetypes":["civilian_any"],"intensity":4,"weight":1.0,"cooldownSeconds":600,"sessionMax":1,"reuseGroup":"civilian_flee","noRepeatGroup":"civilian_flee","conditions":{"all":["shots_fired"],"any":[],"none":[]},"tags":[],"delivery":{"type":"subtitle","text":"Move! Move!","ambientSpeech":null,"voiceAsset":null}},
    {"id":"civilian.flee.04","event":"civilian.flee","speakerArchetypes":["civilian_any"],"intensity":3,"weight":1.0,"cooldownSeconds":600,"sessionMax":1,"reuseGroup":"civilian_flee","noRepeatGroup":"civilian_flee","conditions":{"all":[],"any":[],"none":[]},"tags":[],"delivery":{"type":"subtitle","text":"I'm gone.","ambientSpeech":null,"voiceAsset":null}},
    {"id":"civilian.flee.05","event":"civilian.flee","speakerArchetypes":["civilian_any"],"intensity":4,"weight":0.9,"cooldownSeconds":600,"sessionMax":1,"reuseGroup":"civilian_flee","noRepeatGroup":"civilian_flee","conditions":{"all":[],"any":[],"none":[]},"tags":[],"delivery":{"type":"subtitle","text":"Get out of the way!","ambientSpeech":null,"voiceAsset":null}},
    {"id":"civilian.flee.06","event":"civilian.flee","speakerArchetypes":["civilian_any"],"intensity":4,"weight":0.9,"cooldownSeconds":600,"sessionMax":1,"reuseGroup":"civilian_flee","noRepeatGroup":"civilian_flee","conditions":{"all":[],"any":["shots_fired","witness_high_fear"],"none":[]},"tags":[],"delivery":{"type":"subtitle","text":"Run!","ambientSpeech":null,"voiceAsset":null}},
    {"id":"fallback.civilian.01","event":"fallback.civilian.generic","speakerArchetypes":["civilian_any"],"intensity":1,"weight":0.7,"cooldownSeconds":120,"sessionMax":2,"reuseGroup":"civilian_fallback","noRepeatGroup":"civilian_fallback","conditions":{"all":[],"any":[],"none":[]},"tags":["fallback"],"delivery":{"type":"subtitle","text":"Please.","ambientSpeech":null,"voiceAsset":null}},
    {"id":"fallback.civilian.02","event":"fallback.civilian.generic","speakerArchetypes":["civilian_any"],"intensity":1,"weight":0.7,"cooldownSeconds":120,"sessionMax":2,"reuseGroup":"civilian_fallback","noRepeatGroup":"civilian_fallback","conditions":{"all":[],"any":[],"none":[]},"tags":["fallback"],"delivery":{"type":"subtitle","text":"Okay.","ambientSpeech":null,"voiceAsset":null}},
    {"id":"fallback.civilian.03","event":"fallback.civilian.generic","speakerArchetypes":["civilian_any"],"intensity":1,"weight":0.7,"cooldownSeconds":120,"sessionMax":2,"reuseGroup":"civilian_fallback","noRepeatGroup":"civilian_fallback","conditions":{"all":[],"any":[],"none":[]},"tags":["fallback"],"delivery":{"type":"subtitle","text":"Stay away from me.","ambientSpeech":null,"voiceAsset":null}},
    {"id":"fallback.civilian.04","event":"fallback.civilian.generic","speakerArchetypes":["civilian_any"],"intensity":1,"weight":0.7,"cooldownSeconds":120,"sessionMax":2,"reuseGroup":"civilian_fallback","noRepeatGroup":"civilian_fallback","conditions":{"all":[],"any":[],"none":[]},"tags":["fallback"],"delivery":{"type":"subtitle","text":"I don't want trouble.","ambientSpeech":null,"voiceAsset":null}}
  ]
}
