{
  "schemaVersion": 2,
  "packId": "hostages",
  "speakerGroups": ["HOSTAGE"],
  "fallbackEvent": "fallback.hostage.generic",
  "lines": [
    {"id":"hostage.panic.01","event":"hostage.panic","speakerArchetypes":["hostage_any"],"intensity":3,"weight":1.0,"cooldownSeconds":900,"sessionMax":1,"reuseGroup":"hostage_panic","noRepeatGroup":"hostage_panic","conditions":{"all":[],"any":[],"none":[]},"tags":[],"delivery":{"type":"subtitle","text":"Please don't hurt me.","ambientSpeech":null,"voiceAsset":null}},
    {"id":"hostage.panic.02","event":"hostage.panic","speakerArchetypes":["hostage_any"],"intensity":4,"weight":1.0,"cooldownSeconds":900,"sessionMax":1,"reuseGroup":"hostage_panic","noRepeatGroup":"hostage_panic","conditions":{"all":["shots_fired"],"any":[],"none":[]},"tags":[],"delivery":{"type":"subtitle","text":"I don't want to die.","ambientSpeech":null,"voiceAsset":null}},
    {"id":"hostage.panic.03","event":"hostage.panic","speakerArchetypes":["hostage_any"],"intensity":3,"weight":1.0,"cooldownSeconds":900,"sessionMax":1,"reuseGroup":"hostage_panic","noRepeatGroup":"hostage_panic","conditions":{"all":[],"any":[],"none":[]},"tags":[],"delivery":{"type":"subtitle","text":"Please, just let me go.","ambientSpeech":null,"voiceAsset":null}},
    {"id":"hostage.panic.04","event":"hostage.panic","speakerArchetypes":["hostage_any"],"intensity":4,"weight":0.9,"cooldownSeconds":900,"sessionMax":1,"reuseGroup":"hostage_panic","noRepeatGroup":"hostage_panic","conditions":{"all":[],"any":["hostage_injured","shots_fired"],"none":[]},"tags":[],"delivery":{"type":"subtitle","text":"Oh God, please.","ambientSpeech":null,"voiceAsset":null}},
    {"id":"hostage.panic.05","event":"hostage.panic","speakerArchetypes":["hostage_any"],"intensity":3,"weight":0.9,"cooldownSeconds":900,"sessionMax":1,"reuseGroup":"hostage_panic","noRepeatGroup":"hostage_panic","conditions":{"all":[],"any":[],"none":[]},"tags":[],"delivery":{"type":"subtitle","text":"I'm not doing anything.","ambientSpeech":null,"voiceAsset":null}},
    {"id":"hostage.panic.06","event":"hostage.panic","speakerArchetypes":["hostage_any"],"intensity":4,"weight":1.0,"cooldownSeconds":900,"sessionMax":1,"reuseGroup":"hostage_panic","noRepeatGroup":"hostage_panic","conditions":{"all":["player_close"],"any":[],"none":[]},"tags":[],"delivery":{"type":"subtitle","text":"Please keep that away from me.","ambientSpeech":null,"voiceAsset":null}},
    {"id":"hostage.panic.07","event":"hostage.panic","speakerArchetypes":["hostage_any"],"intensity":3,"weight":0.9,"cooldownSeconds":900,"sessionMax":1,"reuseGroup":"hostage_panic","noRepeatGroup":"hostage_panic","conditions":{"all":[],"any":[],"none":[]},"tags":[],"delivery":{"type":"subtitle","text":"I have nothing to do with this.","ambientSpeech":null,"voiceAsset":null}},
    {"id":"hostage.panic.08","event":"hostage.panic","speakerArchetypes":["hostage_any"],"intensity":4,"weight":0.8,"cooldownSeconds":900,"sessionMax":1,"reuseGroup":"hostage_panic","noRepeatGroup":"hostage_panic","conditions":{"all":[],"any":[],"none":[]},"tags":[],"delivery":{"type":"subtitle","text":"Please, I have a family.","ambientSpeech":null,"voiceAsset":null}},
    {"id":"hostage.comply.01","event":"hostage.comply","speakerArchetypes":["hostage_any"],"intensity":2,"weight":1.0,"cooldownSeconds":900,"sessionMax":1,"reuseGroup":"hostage_compliance","noRepeatGroup":"hostage_compliance","conditions":{"all":[],"any":[],"none":[]},"tags":[],"delivery":{"type":"subtitle","text":"Okay. I'm staying here.","ambientSpeech":null,"voiceAsset":null}},
    {"id":"hostage.comply.02","event":"hostage.comply","speakerArchetypes":["hostage_any"],"intensity":2,"weight":1.0,"cooldownSeconds":900,"sessionMax":1,"reuseGroup":"hostage_compliance","noRepeatGroup":"hostage_compliance","conditions":{"all":[],"any":[],"none":[]},"tags":[],"delivery":{"type":"subtitle","text":"I won't move.","ambientSpeech":null,"voiceAsset":null}},
    {"id":"hostage.comply.03","event":"hostage.comply","speakerArchetypes":["hostage_any"],"intensity":2,"weight":1.0,"cooldownSeconds":900,"sessionMax":1,"reuseGroup":"hostage_compliance","noRepeatGroup":"hostage_compliance","conditions":{"all":[],"any":[],"none":[]},"tags":[],"delivery":{"type":"subtitle","text":"All right, I'm listening.","ambientSpeech":null,"voiceAsset":null}},
    {"id":"hostage.comply.04","event":"hostage.comply","speakerArchetypes":["hostage_any"],"intensity":3,"weight":1.0,"cooldownSeconds":900,"sessionMax":1,"reuseGroup":"hostage_compliance","noRepeatGroup":"hostage_compliance","conditions":{"all":["player_aiming"],"any":[],"none":[]},"tags":[],"delivery":{"type":"subtitle","text":"Okay. Just don't hurt me.","ambientSpeech":null,"voiceAsset":null}},
    {"id":"hostage.comply.05","event":"hostage.comply","speakerArchetypes":["hostage_any"],"intensity":2,"weight":0.9,"cooldownSeconds":900,"sessionMax":1,"reuseGroup":"hostage_compliance","noRepeatGroup":"hostage_compliance","conditions":{"all":[],"any":[],"none":[]},"tags":[],"delivery":{"type":"subtitle","text":"I'm doing what you say.","ambientSpeech":null,"voiceAsset":null}},
    {"id":"hostage.comply.06","event":"hostage.comply","speakerArchetypes":["hostage_any"],"intensity":2,"weight":0.9,"cooldownSeconds":900,"sessionMax":1,"reuseGroup":"hostage_compliance","noRepeatGroup":"hostage_compliance","conditions":{"all":[],"any":[],"none":[]},"tags":[],"delivery":{"type":"subtitle","text":"Fine. I'm staying down.","ambientSpeech":null,"voiceAsset":null}},
    {"id":"fallback.hostage.01","event":"fallback.hostage.generic","speakerArchetypes":["hostage_any"],"intensity":1,"weight":0.7,"cooldownSeconds":120,"sessionMax":2,"reuseGroup":"hostage_fallback","noRepeatGroup":"hostage_fallback","conditions":{"all":[],"any":[],"none":[]},"tags":["fallback"],"delivery":{"type":"subtitle","text":"Okay.","ambientSpeech":null,"voiceAsset":null}},
    {"id":"fallback.hostage.02","event":"fallback.hostage.generic","speakerArchetypes":["hostage_any"],"intensity":1,"weight":0.7,"cooldownSeconds":120,"sessionMax":2,"reuseGroup":"hostage_fallback","noRepeatGroup":"hostage_fallback","conditions":{"all":[],"any":[],"none":[]},"tags":["fallback"],"delivery":{"type":"subtitle","text":"Please.","ambientSpeech":null,"voiceAsset":null}},
    {"id":"fallback.hostage.03","event":"fallback.hostage.generic","speakerArchetypes":["hostage_any"],"intensity":1,"weight":0.7,"cooldownSeconds":120,"sessionMax":2,"reuseGroup":"hostage_fallback","noRepeatGroup":"hostage_fallback","conditions":{"all":[],"any":[],"none":[]},"tags":["fallback"],"delivery":{"type":"subtitle","text":"I'm listening.","ambientSpeech":null,"voiceAsset":null}},
    {"id":"fallback.hostage.04","event":"fallback.hostage.generic","speakerArchetypes":["hostage_any"],"intensity":1,"weight":0.7,"cooldownSeconds":120,"sessionMax":2,"reuseGroup":"hostage_fallback","noRepeatGroup":"hostage_fallback","conditions":{"all":[],"any":[],"none":[]},"tags":["fallback"],"delivery":{"type":"subtitle","text":"I won't move.","ambientSpeech":null,"voiceAsset":null}}
  ]
}
